{
  "$schema": "https://json-schema.org/draft/2020-12/schema",
  "$id": "https://example.com/trajectory_record.schema.json",
  "title": "TrajectoryRecord",
  "type": "object",
  "additionalProperties": false,
  "required": [
    "task_id",
    "instruction",
    "site",
    "success",
    "max_steps",
    "steps"
  ],
  "properties": {
    "task_id": {"type": "string", "minLength": 1},
    "instruction": {"type": "string", "minLength": 1},
    "site": {"type": "string", "minLength": 1},
    "success": {"type": "boolean"},
    "max_steps": {"type": "integer", "minimum": 1},
    "steps": {
      "type": "array",
      "minItems": 1,
      "items": {
        "type": "object",
        "additionalProperties": false,
        "required": [
          "step",
          "url",
          "action_type",
          "action",
          "target",
          "observation",
          "tags",
          "checkpoint"
        ],
        "properties": {
          "step": {"type": "integer", "minimum": 1},
          "url": {"type": "string", "minLength": 1},
          "action_type": {"type": "string", "minLength": 1},
          "action": {"type": "string", "minLength": 1},
          "target": {"type": "string", "minLength": 1},
          "value": {"type": ["string", "null"]},
          "observation": {"type": "string", "minLength": 1},
          "tags": {
            "type": "array",
            "items": {"type": "string"}
          },
          "checkpoint": {"type": "boolean"}
        }
      }
    }
  }
}
